{
  "$schema": "https://capy.network/schemas/v1/episode-cohort.schema.json",
  "protocol_version": "1.0.0",
  "schema_version": "1.0.0",
  "object_type": "episode_cohort",
  "object_id": "urn:uuid:22222222-2222-4222-8222-222222222222",
  "issued_at": "2026-09-02T22:15:00Z",
  "payload": {
    "capability": {
      "object_id": "urn:uuid:11111111-1111-4111-8111-111111111111",
      "object_type": "capability_manifest",
      "object_digest": "sha256:49b5c0b6f0020dd8460850d5aed320d1e04ccf0543506818a7e3c84b9de69e2c"
    },
    "collection_job_id": "urn:capy:collection-job:yam-button-2026-09-01",
    "collector": {
      "actor_id": "urn:capy:actor:collection-lab",
      "role": "collector",
      "key_id": "urn:capy:key:collection-lab-2026-01"
    },
    "status": "accepted",
    "collection_window": {
      "started_at": "2026-09-01T17:00:00Z",
      "ended_at": "2026-09-02T20:30:00Z"
    },
    "contributors": [
      {
        "contributor_id": "urn:capy:contributor:operator-17",
        "actor": {
          "actor_id": "urn:capy:actor:operator-17",
          "role": "operator",
          "key_id": "urn:capy:key:operator-17-2026-01"
        },
        "roles": [
          "operator"
        ],
        "episode_count": 120,
        "episode_ids_digest": "sha256:7777777777777777777777777777777777777777777777777777777777777777",
        "episode_assignment": {
          "uri": "https://artifacts.example.capy.network/cohorts/yam-button-001/operator-17-episodes.json",
          "media_type": "application/json",
          "digest": "sha256:8888888888888888888888888888888888888888888888888888888888888888",
          "size_bytes": "1694"
        },
        "payout_eligible": true
      },
      {
        "contributor_id": "urn:capy:contributor:fixture-lab",
        "actor": {
          "actor_id": "urn:capy:actor:fixture-lab",
          "role": "environment_provider",
          "key_id": "urn:capy:key:fixture-lab-2026-01"
        },
        "roles": [
          "environment_provider",
          "hardware_provider"
        ],
        "episode_count": 120,
        "episode_ids_digest": "sha256:7777777777777777777777777777777777777777777777777777777777777777",
        "episode_assignment": {
          "uri": "https://artifacts.example.capy.network/cohorts/yam-button-001/fixture-lab-episodes.json",
          "media_type": "application/json",
          "digest": "sha256:9999999999999999999999999999999999999999999999999999999999999999",
          "size_bytes": "1694"
        },
        "payout_eligible": true
      }
    ],
    "episode_set": {
      "episode_count": 120,
      "successful_episode_count": 113,
      "episode_ids_digest": "sha256:7777777777777777777777777777777777777777777777777777777777777777",
      "episode_manifest": {
        "uri": "https://artifacts.example.capy.network/cohorts/yam-button-001/episodes.parquet",
        "media_type": "application/vnd.apache.parquet",
        "digest": "sha256:abababababababababababababababababababababababababababababababab",
        "size_bytes": "28594"
      }
    },
    "raw_recordings": [
      {
        "recording_id": "yam-button-001-raw",
        "artifact": {
          "uri": "https://artifacts.example.capy.network/cohorts/yam-button-001/raw.mcap",
          "media_type": "application/x-mcap",
          "digest": "sha256:bbbbbbbbbbbbbbbbbbbbbbbbbbbbbbbbbbbbbbbbbbbbbbbbbbbbbbbbbbbbbbbb",
          "size_bytes": "881229140"
        },
        "container": "MCAP",
        "container_major_version": "0",
        "profile": "capy.i2rt.camera_free.v1",
        "producer": {
          "kind": "direct_i2rt",
          "name": "capy_i2rt_recorder",
          "version": "0.1.0",
          "source_revision": "47fee5e7dec4e30ca054f798bda1c8894b465ed2"
        },
        "message_encoding": "json",
        "schema_encoding": "jsonschema",
        "topics_digest": "sha256:cdcdcdcdcdcdcdcdcdcdcdcdcdcdcdcdcdcdcdcdcdcdcdcdcdcdcdcdcdcdcdcd",
        "clock_basis": "system_time",
        "indexed": true,
        "crc_verified": true,
        "source_journal": {
          "format": "capy.ndjson.camera_free.v1",
          "manifest_digest": "sha256:bcbcbcbcbcbcbcbcbcbcbcbcbcbcbcbcbcbcbcbcbcbcbcbcbcbcbcbcbcbcbcbc",
          "events_digest": "sha256:acacacacacacacacacacacacacacacacacacacacacacacacacacacacacacacac"
        }
      }
    ],
    "normalized_dataset": {
      "artifact": {
        "uri": "https://artifacts.example.capy.network/cohorts/yam-button-001/lerobot-v3.tar",
        "media_type": "application/x-tar",
        "digest": "sha256:dededededededededededededededededededededededededededededededede",
        "size_bytes": "52177012"
      },
      "format": "LeRobotDataset",
      "format_version": "v3.0",
      "producer": {
        "package": "lerobot",
        "package_version": "0.4.0",
        "source_revision": "0123456789abcdef0123456789abcdef01234567"
      },
      "dataset_revision": "sha256:efefefefefefefefefefefefefefefefefefefefefefefefefefefefefefefef",
      "fps": 50,
      "use_videos": false,
      "features": [
        {
          "key": "observation.state",
          "dtype": "float32",
          "shape": [
            21
          ],
          "names": [
            "joint_0.position",
            "joint_1.position",
            "joint_2.position",
            "joint_3.position",
            "joint_4.position",
            "joint_5.position",
            "gripper.position",
            "joint_0.velocity",
            "joint_1.velocity",
            "joint_2.velocity",
            "joint_3.velocity",
            "joint_4.velocity",
            "joint_5.velocity",
            "gripper.velocity",
            "joint_0.effort",
            "joint_1.effort",
            "joint_2.effort",
            "joint_3.effort",
            "joint_4.effort",
            "joint_5.effort",
            "gripper.effort"
          ]
        },
        {
          "key": "observation.intervention_active",
          "dtype": "bool",
          "shape": [
            1
          ],
          "names": [
            "active"
          ]
        },
        {
          "key": "observation.safety_active",
          "dtype": "bool",
          "shape": [
            1
          ],
          "names": [
            "active"
          ]
        },
        {
          "key": "action",
          "dtype": "float32",
          "shape": [
            7
          ],
          "names": [
            "joint_0",
            "joint_1",
            "joint_2",
            "joint_3",
            "joint_4",
            "joint_5",
            "gripper"
          ]
        },
        {
          "key": "timestamp",
          "dtype": "float64",
          "shape": [
            1
          ],
          "names": [
            "seconds"
          ]
        }
      ],
      "source_recording_digests": [
        "sha256:bbbbbbbbbbbbbbbbbbbbbbbbbbbbbbbbbbbbbbbbbbbbbbbbbbbbbbbbbbbbbbbb"
      ],
      "normalization_transform": {
        "uri": "https://artifacts.example.capy.network/transforms/mcap-to-lerobot-yam-button-v1.py",
        "media_type": "text/x-python",
        "digest": "sha256:f0f0f0f0f0f0f0f0f0f0f0f0f0f0f0f0f0f0f0f0f0f0f0f0f0f0f0f0f0f0f0f0",
        "size_bytes": "18341"
      }
    },
    "quality": {
      "validator_version": "1.0.0",
      "timestamp_monotonicity": true,
      "required_topics_present": true,
      "action_state_alignment_ms_p95": "4.8",
      "rejected_episode_ids": [],
      "report": {
        "uri": "https://artifacts.example.capy.network/cohorts/yam-button-001/quality-report.json",
        "media_type": "application/json",
        "digest": "sha256:0101010101010101010101010101010101010101010101010101010101010101",
        "size_bytes": "9430"
      }
    },
    "rights": [
      {
        "rights_id": "urn:capy:rights:operator-17-yam-button-001",
        "licensor": {
          "actor_id": "urn:capy:actor:operator-17",
          "role": "licensor",
          "key_id": "urn:capy:key:operator-17-2026-01"
        },
        "grantee": {
          "actor_id": "urn:capy:actor:capy-network",
          "role": "grantee",
          "key_id": "urn:capy:key:capy-network-2026-01"
        },
        "license_document": {
          "uri": "https://artifacts.example.capy.network/rights/operator-17-yam-button-001.json",
          "media_type": "application/json",
          "digest": "sha256:1212121212121212121212121212121212121212121212121212121212121212",
          "size_bytes": "7182",
          "encryption": {
            "scheme": "age-x25519",
            "key_reference": "urn:capy:kms:rights-reviewers"
          }
        },
        "grants": [
          {
            "grant_id": "operator-experience-grant",
            "purposes": [
              "quality_control",
              "training",
              "evaluation",
              "model_distribution",
              "commercialization",
              "audit"
            ],
            "commercial_use": true,
            "derivatives": true,
            "sublicensing": true,
            "valid_from": "2026-09-01T16:30:00Z",
            "valid_until": null,
            "territories": [
              "worldwide"
            ],
            "restrictions": [
              "no attempt to identify the pseudonymous operator from robot telemetry"
            ]
          }
        ]
      },
      {
        "rights_id": "urn:capy:rights:fixture-lab-yam-button-001",
        "licensor": {
          "actor_id": "urn:capy:actor:fixture-lab",
          "role": "licensor",
          "key_id": "urn:capy:key:fixture-lab-2026-01"
        },
        "grantee": {
          "actor_id": "urn:capy:actor:capy-network",
          "role": "grantee",
          "key_id": "urn:capy:key:capy-network-2026-01"
        },
        "license_document": {
          "uri": "https://artifacts.example.capy.network/rights/fixture-lab-yam-button-001.json",
          "media_type": "application/json",